{
  "date": "SÁB 13 SEP",
  "time": "10:00 AM",
  "category": "Sub-13",
  "categorySlug": "form-baja",
  "home": "PCFC",
  "homeLogo": "/Logo-PCFC.svg",
  "away": "Atlético Bávaro",
  "awayLogo": "https://images.unsplash.com/photo-1579952363873-27f3bade9f55?w=200&q=80",
  "venue": "Cancha Principal · PCFC"
}
